{
  "schema_version": 2,
  "suite": "fp864x-fp664-curated",
  "timestamp_utc": "20260919T081506Z",
  "device": {
    "name": "NVIDIA GeForce RTX 5090",
    "compute_capability": "12.0",
    "sm_count": 170,
    "reported_clock_mhz": 2407.000,
    "driver_api": 13000,
    "ptx": "9.0",
    "target": "sm_120a"
  },
  "config": {
    "iters": 4000,
    "blocks_per_sm": 4,
    "chains": 8,
    "inner_unroll": 4,
    "repeats": 5,
    "filter": ""
  },
  "summary": {
    "selected": 19,
    "passed": 19,
    "failed": 0,
    "peaks": {
      "unscaled_f8f6f4": {"tflops": 510.426905, "case_name": "dense/f8f6f4/e4m3xe3m2/acc-f32"},
      "mxf8f6f4": {"tflops": 1001.448971, "case_name": "dense/mxf8f6f4/e4m3xe3m2/ue8m0-1X"},
      "mxf4": {"tflops": 2002.189279, "case_name": "dense/mxf4/e2m1xe2m1/ue8m0-2X"},
      "mxf4nvf4": {"tflops": 2003.033095, "case_name": "dense/mxf4nvf4/e2m1xe2m1/ue4m3-4X"}
    }
  },
  "cases": [
    {
      "status": "PASS",
      "name": "dense/f8f6f4/e4m3xe3m2/acc-f32",
      "opcode": "mma.sync.aligned.kind::f8f6f4.m16n8k32.row.col.f32.e4m3.e3m2.f32",
      "ptx_version": "9.0",
      "ptx_path": "results/20260919T081506Z_NVIDIA_GeForce_RTX_5090_fp864x_fp664/artifacts/dense_f8f6f4_e4m3xe3m2_acc-f32/generated.ptx",
      "cuda_repro_path": "results/20260919T081506Z_NVIDIA_GeForce_RTX_5090_fp864x_fp664/artifacts/dense_f8f6f4_e4m3xe3m2_acc-f32/inline_ptx_repro.cu",
      "jit_error_log_path": "results/20260919T081506Z_NVIDIA_GeForce_RTX_5090_fp864x_fp664/artifacts/dense_f8f6f4_e4m3xe3m2_acc-f32/jit_error.log",
      "jit_info_log_path": "results/20260919T081506Z_NVIDIA_GeForce_RTX_5090_fp864x_fp664/artifacts/dense_f8f6f4_e4m3xe3m2_acc-f32/jit_info.log",
      "jit_error_log": "",
      "jit_info_log": "",
      "error": null,
      "best_ms": 11.175456,
      "mean_ms": 11.201384,
      "peak_logical_tflops": 510.426905,
      "mean_logical_tflops": 509.245433,
      "regs_per_thread": 42
    },
    {
      "status": "PASS",
      "name": "dense/f8f6f4/e4m3xe2m3/acc-f32",
      "opcode": "mma.sync.aligned.kind::f8f6f4.m16n8k32.row.col.f32.e4m3.e2m3.f32",
      "ptx_version": "9.0",
      "ptx_path": "results/20260919T081506Z_NVIDIA_GeForce_RTX_5090_fp864x_fp664/artifacts/dense_f8f6f4_e4m3xe2m3_acc-f32/generated.ptx",
      "cuda_repro_path": "results/20260919T081506Z_NVIDIA_GeForce_RTX_5090_fp864x_fp664/artifacts/dense_f8f6f4_e4m3xe2m3_acc-f32/inline_ptx_repro.cu",
      "jit_error_log_path": "results/20260919T081506Z_NVIDIA_GeForce_RTX_5090_fp864x_fp664/artifacts/dense_f8f6f4_e4m3xe2m3_acc-f32/jit_error.log",
      "jit_info_log_path": "results/20260919T081506Z_NVIDIA_GeForce_RTX_5090_fp864x_fp664/artifacts/dense_f8f6f4_e4m3xe2m3_acc-f32/jit_info.log",
      "jit_error_log": "",
      "jit_info_log": "",
      "error": null,
      "best_ms": 11.227840,
      "mean_ms": 11.231398,
      "peak_logical_tflops": 508.045468,
      "mean_logical_tflops": 507.884560,
      "regs_per_thread": 42
    },
    {
      "status": "PASS",
      "name": "dense/f8f6f4/e4m3xe2m1/acc-f32",
      "opcode": "mma.sync.aligned.kind::f8f6f4.m16n8k32.row.col.f32.e4m3.e2m1.f32",
      "ptx_version": "9.0",
      "ptx_path": "results/20260919T081506Z_NVIDIA_GeForce_RTX_5090_fp864x_fp664/artifacts/dense_f8f6f4_e4m3xe2m1_acc-f32/generated.ptx",
      "cuda_repro_path": "results/20260919T081506Z_NVIDIA_GeForce_RTX_5090_fp864x_fp664/artifacts/dense_f8f6f4_e4m3xe2m1_acc-f32/inline_ptx_repro.cu",
      "jit_error_log_path": "results/20260919T081506Z_NVIDIA_GeForce_RTX_5090_fp864x_fp664/artifacts/dense_f8f6f4_e4m3xe2m1_acc-f32/jit_error.log",
      "jit_info_log_path": "results/20260919T081506Z_NVIDIA_GeForce_RTX_5090_fp864x_fp664/artifacts/dense_f8f6f4_e4m3xe2m1_acc-f32/jit_info.log",
      "jit_error_log": "",
      "jit_info_log": "",
      "error": null,
      "best_ms": 11.228896,
      "mean_ms": 11.232397,
      "peak_logical_tflops": 507.997702,
      "mean_logical_tflops": 507.839369,
      "regs_per_thread": 42
    },
    {
      "status": "PASS",
      "name": "dense/f8f6f4/e5m2xe3m2/acc-f32",
      "opcode": "mma.sync.aligned.kind::f8f6f4.m16n8k32.row.col.f32.e5m2.e3m2.f32",
      "ptx_version": "9.0",
      "ptx_path": "results/20260919T081506Z_NVIDIA_GeForce_RTX_5090_fp864x_fp664/artifacts/dense_f8f6f4_e5m2xe3m2_acc-f32/generated.ptx",
      "cuda_repro_path": "results/20260919T081506Z_NVIDIA_GeForce_RTX_5090_fp864x_fp664/artifacts/dense_f8f6f4_e5m2xe3m2_acc-f32/inline_ptx_repro.cu",
      "jit_error_log_path": "results/20260919T081506Z_NVIDIA_GeForce_RTX_5090_fp864x_fp664/artifacts/dense_f8f6f4_e5m2xe3m2_acc-f32/jit_error.log",
      "jit_info_log_path": "results/20260919T081506Z_NVIDIA_GeForce_RTX_5090_fp864x_fp664/artifacts/dense_f8f6f4_e5m2xe3m2_acc-f32/jit_info.log",
      "jit_error_log": "",
      "jit_info_log": "",
      "error": null,
      "best_ms": 11.230464,
      "mean_ms": 11.232678,
      "peak_logical_tflops": 507.926783,
      "mean_logical_tflops": 507.826649,
      "regs_per_thread": 42
    },
    {
      "status": "PASS",
      "name": "dense/f8f6f4/e5m2xe2m1/acc-f32",
      "opcode": "mma.sync.aligned.kind::f8f6f4.m16n8k32.row.col.f32.e5m2.e2m1.f32",
      "ptx_version": "9.0",
      "ptx_path": "results/20260919T081506Z_NVIDIA_GeForce_RTX_5090_fp864x_fp664/artifacts/dense_f8f6f4_e5m2xe2m1_acc-f32/generated.ptx",
      "cuda_repro_path": "results/20260919T081506Z_NVIDIA_GeForce_RTX_5090_fp864x_fp664/artifacts/dense_f8f6f4_e5m2xe2m1_acc-f32/inline_ptx_repro.cu",
      "jit_error_log_path": "results/20260919T081506Z_NVIDIA_GeForce_RTX_5090_fp864x_fp664/artifacts/dense_f8f6f4_e5m2xe2m1_acc-f32/jit_error.log",
      "jit_info_log_path": "results/20260919T081506Z_NVIDIA_GeForce_RTX_5090_fp864x_fp664/artifacts/dense_f8f6f4_e5m2xe2m1_acc-f32/jit_info.log",
      "jit_error_log": "",
      "jit_info_log": "",
      "error": null,
      "best_ms": 11.229312,
      "mean_ms": 11.232366,
      "peak_logical_tflops": 507.978892,
      "mean_logical_tflops": 507.840791,
      "regs_per_thread": 42
    },
    {
      "status": "PASS",
      "name": "dense/f8f6f4/e3m2xe3m2/acc-f32",
      "opcode": "mma.sync.aligned.kind::f8f6f4.m16n8k32.row.col.f32.e3m2.e3m2.f32",
      "ptx_version": "9.0",
      "ptx_path": "results/20260919T081506Z_NVIDIA_GeForce_RTX_5090_fp864x_fp664/artifacts/dense_f8f6f4_e3m2xe3m2_acc-f32/generated.ptx",
      "cuda_repro_path": "results/20260919T081506Z_NVIDIA_GeForce_RTX_5090_fp864x_fp664/artifacts/dense_f8f6f4_e3m2xe3m2_acc-f32/inline_ptx_repro.cu",
      "jit_error_log_path": "results/20260919T081506Z_NVIDIA_GeForce_RTX_5090_fp864x_fp664/artifacts/dense_f8f6f4_e3m2xe3m2_acc-f32/jit_error.log",
      "jit_info_log_path": "results/20260919T081506Z_NVIDIA_GeForce_RTX_5090_fp864x_fp664/artifacts/dense_f8f6f4_e3m2xe3m2_acc-f32/jit_info.log",
      "jit_error_log": "",
      "jit_info_log": "",
      "error": null,
      "best_ms": 11.229152,
      "mean_ms": 11.231207,
      "peak_logical_tflops": 507.986140,
      "mean_logical_tflops": 507.893185,
      "regs_per_thread": 42
    },
    {
      "status": "PASS",
      "name": "dense/f8f6f4/e3m2xe2m1/acc-f32",
      "opcode": "mma.sync.aligned.kind::f8f6f4.m16n8k32.row.col.f32.e3m2.e2m1.f32",
      "ptx_version": "9.0",
      "ptx_path": "results/20260919T081506Z_NVIDIA_GeForce_RTX_5090_fp864x_fp664/artifacts/dense_f8f6f4_e3m2xe2m1_acc-f32/generated.ptx",
      "cuda_repro_path": "results/20260919T081506Z_NVIDIA_GeForce_RTX_5090_fp864x_fp664/artifacts/dense_f8f6f4_e3m2xe2m1_acc-f32/inline_ptx_repro.cu",
      "jit_error_log_path": "results/20260919T081506Z_NVIDIA_GeForce_RTX_5090_fp864x_fp664/artifacts/dense_f8f6f4_e3m2xe2m1_acc-f32/jit_error.log",
      "jit_info_log_path": "results/20260919T081506Z_NVIDIA_GeForce_RTX_5090_fp864x_fp664/artifacts/dense_f8f6f4_e3m2xe2m1_acc-f32/jit_info.log",
      "jit_error_log": "",
      "jit_info_log": "",
      "error": null,
      "best_ms": 11.230432,
      "mean_ms": 11.232698,
      "peak_logical_tflops": 507.928249,
      "mean_logical_tflops": 507.825744,
      "regs_per_thread": 42
    },
    {
      "status": "PASS",
      "name": "dense/f8f6f4/e2m3xe2m3/acc-f32",
      "opcode": "mma.sync.aligned.kind::f8f6f4.m16n8k32.row.col.f32.e2m3.e2m3.f32",
      "ptx_version": "9.0",
      "ptx_path": "results/20260919T081506Z_NVIDIA_GeForce_RTX_5090_fp864x_fp664/artifacts/dense_f8f6f4_e2m3xe2m3_acc-f32/generated.ptx",
      "cuda_repro_path": "results/20260919T081506Z_NVIDIA_GeForce_RTX_5090_fp864x_fp664/artifacts/dense_f8f6f4_e2m3xe2m3_acc-f32/inline_ptx_repro.cu",
      "jit_error_log_path": "results/20260919T081506Z_NVIDIA_GeForce_RTX_5090_fp864x_fp664/artifacts/dense_f8f6f4_e2m3xe2m3_acc-f32/jit_error.log",
      "jit_info_log_path": "results/20260919T081506Z_NVIDIA_GeForce_RTX_5090_fp864x_fp664/artifacts/dense_f8f6f4_e2m3xe2m3_acc-f32/jit_info.log",
      "jit_error_log": "",
      "jit_info_log": "",
      "error": null,
      "best_ms": 11.230528,
      "mean_ms": 11.231680,
      "peak_logical_tflops": 507.923893,
      "mean_logical_tflops": 507.871795,
      "regs_per_thread": 42
    },
    {
      "status": "PASS",
      "name": "dense/f8f6f4/e2m3xe2m1/acc-f32",
      "opcode": "mma.sync.aligned.kind::f8f6f4.m16n8k32.row.col.f32.e2m3.e2m1.f32",
      "ptx_version": "9.0",
      "ptx_path": "results/20260919T081506Z_NVIDIA_GeForce_RTX_5090_fp864x_fp664/artifacts/dense_f8f6f4_e2m3xe2m1_acc-f32/generated.ptx",
      "cuda_repro_path": "results/20260919T081506Z_NVIDIA_GeForce_RTX_5090_fp864x_fp664/artifacts/dense_f8f6f4_e2m3xe2m1_acc-f32/inline_ptx_repro.cu",
      "jit_error_log_path": "results/20260919T081506Z_NVIDIA_GeForce_RTX_5090_fp864x_fp664/artifacts/dense_f8f6f4_e2m3xe2m1_acc-f32/jit_error.log",
      "jit_info_log_path": "results/20260919T081506Z_NVIDIA_GeForce_RTX_5090_fp864x_fp664/artifacts/dense_f8f6f4_e2m3xe2m1_acc-f32/jit_info.log",
      "jit_error_log": "",
      "jit_info_log": "",
      "error": null,
      "best_ms": 11.230112,
      "mean_ms": 11.232595,